{
  "schema_version":"2.0.0","profile_id":"article-type:nature-communications/article","display_name":"Nature Communications — Article","profile_version":"1.0.0","source_snapshot_version":"1.0.0","profile_kind":"ARTICLE_TYPE","precedence":300,
  "parents":[{"profile_id":"journal:nature-communications","profile_version":"1.0.0"}],
  "journal":{"name":"Nature Communications","publisher":"Nature Portfolio","issn":["2041-1723"],"journal_url":"https://www.nature.com/ncomms/"},"article_type":"Article",
  "sources":[
    {"source_id":"src:ncomms.article","source_url":"https://www.nature.com/ncomms/submit/article","source_type":"OFFICIAL_ARTICLE_TYPE_GUIDELINE","retrieved_at":"2026-09-29T00:00:00Z","source_title":"Nature Communications: Article","owner":"Nature Communications","snapshot_hash":"sha256:bd7021c9b0acbdf6965f927de628642e9d785765d3e8eca3844b6996ea6920c8","snapshot_scope":"EVIDENCE_EXTRACT","content_stored":false,"verification_status":"VERIFIED"},
    {"source_id":"src:ncomms.article-structure","source_url":"https://www.nature.com/ncomms/submit/article","source_type":"OFFICIAL_ARTICLE_TYPE_GUIDELINE","retrieved_at":"2026-09-29T00:00:00Z","source_title":"Nature Communications: Article","owner":"Nature Communications","snapshot_hash":"sha256:c90e865873f6b16328b544e63003da428fe36bf6c77003cbb6a96dccf18b80d0","snapshot_scope":"EVIDENCE_EXTRACT","content_stored":false,"verification_status":"VERIFIED"},
    {"source_id":"src:ncomms.how-to-submit","source_url":"https://www.nature.com/ncomms/submit/how-to-submit","source_type":"OFFICIAL_SUBMISSION_PORTAL","retrieved_at":"2026-09-29T00:00:00Z","source_title":"Nature Communications: How to submit","owner":"Nature Communications","snapshot_hash":"sha256:7c746984e67606f08b49d08dc928eb019b923c7b739db583a179e41739a35af4","snapshot_scope":"EVIDENCE_EXTRACT","content_stored":false,"verification_status":"VERIFIED"}
  ],
  "evidence":[
    {"evidence_id":"ev:ncomms.article-limits","source_id":"src:ncomms.article","locator":"Article > Format","evidence_text":"Article limits: title 15 words; abstract 200 words; main text ideally 5,000 words; references guideline 70; display items up to 10.","evidence_hash":"sha256:bd7021c9b0acbdf6965f927de628642e9d785765d3e8eca3844b6996ea6920c8"},
    {"evidence_id":"ev:ncomms.article-structure","source_id":"src:ncomms.article-structure","locator":"Article > Format","evidence_text":"Article structure uses Introduction, Results, Discussion where appropriate, and Methods where appropriate; footnotes are not used.","evidence_hash":"sha256:c90e865873f6b16328b544e63003da428fe36bf6c77003cbb6a96dccf18b80d0"},
    {"evidence_id":"ev:ncomms.initial-files","source_id":"src:ncomms.how-to-submit","locator":"Initial submission","evidence_text":"Initial submissions may be Word, TeX or PDF, in one file up to 30 MB; supplementary information is separate.","evidence_hash":"sha256:c98007658e4fc67fc0a0fd778a8e5de6c393e5abd828b02748aba6e0c0543e4b"},
    {"evidence_id":"ev:ncomms.submission-materials","source_id":"src:ncomms.how-to-submit","locator":"Online submission","evidence_text":"Online submission includes a cover letter, manuscript text, individual figure files and optional supplementary information.","evidence_hash":"sha256:99f5dc400fbc10e655e83b0a2f0afa1a9a669ae676a32c35567d3798d53b86b7"}
  ],
  "rules":[
    {"rule_id":"identity.article_type","rule_version":"1.0.0","category":"IDENTITY","target":"article_type","operator":"EQ","value":"Article","unit":null,"severity":"BLOCKING","applicability":"This profile","machine_checkable":true,"autofix_class":"NONE","provenance":[{"source_id":"src:ncomms.article","evidence_id":"ev:ncomms.article-limits"}],"confidence":"HIGH","status":"VERIFIED","override_of":null,"override_reason":null},
    {"rule_id":"title.max_words","rule_version":"1.0.0","category":"LIMIT","target":"title","operator":"LTE","value":15,"unit":"words","severity":"BLOCKING","applicability":"Article","machine_checkable":true,"autofix_class":"AUTHOR_APPROVAL_REQUIRED","provenance":[{"source_id":"src:ncomms.article","evidence_id":"ev:ncomms.article-limits"}],"confidence":"HIGH","status":"VERIFIED","override_of":null,"override_reason":null},
    {"rule_id":"abstract.max_words","rule_version":"1.0.0","category":"LIMIT","target":"abstract","operator":"LTE","value":200,"unit":"words","severity":"BLOCKING","applicability":"Article","machine_checkable":true,"autofix_class":"AUTHOR_APPROVAL_REQUIRED","provenance":[{"source_id":"src:ncomms.article","evidence_id":"ev:ncomms.article-limits"}],"confidence":"HIGH","status":"VERIFIED","override_of":null,"override_reason":null},
    {"rule_id":"main_text.max_words","rule_version":"1.0.0","category":"LIMIT","target":"main_text","operator":"LTE","value":5000,"unit":"words","severity":"WARNING","applicability":"Article; stated as ideal, excluding abstract, Methods, references and figure legends","machine_checkable":true,"autofix_class":"AUTHOR_APPROVAL_REQUIRED","provenance":[{"source_id":"src:ncomms.article","evidence_id":"ev:ncomms.article-limits"}],"confidence":"MEDIUM","status":"PARTIAL","override_of":null,"override_reason":null},
    {"rule_id":"references.max_count","rule_version":"1.0.0","category":"REFERENCE","target":"references","operator":"LTE","value":70,"unit":"references","severity":"WARNING","applicability":"Article; guideline","machine_checkable":true,"autofix_class":"AUTHOR_APPROVAL_REQUIRED","provenance":[{"source_id":"src:ncomms.article","evidence_id":"ev:ncomms.article-limits"}],"confidence":"MEDIUM","status":"PARTIAL","override_of":null,"override_reason":null},
    {"rule_id":"display_items.max_count","rule_version":"1.0.0","category":"FIGURE","target":"figures_and_tables","operator":"LTE","value":10,"unit":"items","severity":"WARNING","applicability":"Article; allowance depends on manuscript length","machine_checkable":true,"autofix_class":"AUTHOR_APPROVAL_REQUIRED","provenance":[{"source_id":"src:ncomms.article","evidence_id":"ev:ncomms.article-limits"}],"confidence":"MEDIUM","status":"PARTIAL","override_of":null,"override_reason":null},
    {"rule_id":"sections.required","rule_version":"1.0.0","category":"SECTION","target":"section_order","operator":"EQ","value":["Introduction","Results","Discussion","Methods"],"unit":null,"severity":"BLOCKING","applicability":"Article; Discussion and Methods where appropriate","machine_checkable":true,"autofix_class":"AUTHOR_APPROVAL_REQUIRED","provenance":[{"source_id":"src:ncomms.article-structure","evidence_id":"ev:ncomms.article-structure"}],"confidence":"MEDIUM","status":"PARTIAL","override_of":null,"override_reason":null},
    {"rule_id":"cover_letter.required","rule_version":"1.0.0","category":"FILE","target":"cover_letter","operator":"EXISTS","value":true,"unit":null,"severity":"BLOCKING","applicability":"Online submission","machine_checkable":true,"autofix_class":"AUTHOR_APPROVAL_REQUIRED","provenance":[{"source_id":"src:ncomms.how-to-submit","evidence_id":"ev:ncomms.submission-materials"}],"confidence":"HIGH","status":"VERIFIED","override_of":null,"override_reason":null},
    {"rule_id":"supplement.allowed","rule_version":"1.0.0","category":"FILE","target":"supplementary_information","operator":"EXISTS","value":"OPTIONAL","unit":null,"severity":"INFO","applicability":"Article","machine_checkable":true,"autofix_class":"NONE","provenance":[{"source_id":"src:ncomms.how-to-submit","evidence_id":"ev:ncomms.submission-materials"}],"confidence":"HIGH","status":"VERIFIED","override_of":null,"override_reason":null},
    {"rule_id":"figures.separate_files","rule_version":"1.0.0","category":"FILE","target":"figure_files","operator":"EXISTS","value":true,"unit":null,"severity":"BLOCKING","applicability":"Online submission package; initial combined-file route also exists","machine_checkable":true,"autofix_class":"CONTENT_PRESERVING_AUTOMATIC","provenance":[{"source_id":"src:ncomms.how-to-submit","evidence_id":"ev:ncomms.submission-materials"}],"confidence":"MEDIUM","status":"PARTIAL","override_of":null,"override_reason":null},
    {"rule_id":"statements.code_availability.required","rule_version":"1.0.0","category":"STATEMENT","target":"code_availability","operator":"EXISTS","value":"UNKNOWN","unit":null,"severity":"WARNING","applicability":"Article","machine_checkable":false,"autofix_class":"NONE","provenance":[],"confidence":"UNKNOWN","status":"UNKNOWN","override_of":null,"override_reason":null},
    {"rule_id":"statements.ethics_consent.required","rule_version":"1.0.0","category":"STATEMENT","target":"ethics_and_consent","operator":"EXISTS","value":"UNKNOWN","unit":null,"severity":"WARNING","applicability":"Where research design makes it applicable","machine_checkable":false,"autofix_class":"NONE","provenance":[],"confidence":"UNKNOWN","status":"UNKNOWN","override_of":null,"override_reason":null},
    {"rule_id":"title_page.requirements","rule_version":"1.0.0","category":"FILE","target":"title_page","operator":"CUSTOM","value":"UNKNOWN","unit":null,"severity":"WARNING","applicability":"Article","machine_checkable":false,"autofix_class":"NONE","provenance":[],"confidence":"UNKNOWN","status":"UNKNOWN","override_of":null,"override_reason":null}
  ],
  "last_verified_at":"2026-09-29T00:00:00Z","freshness_window_days":180,"status":"PARTIAL"
}
