{
  "schema_version":"2.0.0","profile_id":"article-type:nature-machine-intelligence/article","display_name":"Nature Machine Intelligence — Article","profile_version":"1.0.0","source_snapshot_version":"1.0.0","profile_kind":"ARTICLE_TYPE","precedence":300,"parents":[{"profile_id":"journal:nature-machine-intelligence","profile_version":"1.0.0"}],
  "journal":{"name":"Nature Machine Intelligence","publisher":"Nature Portfolio","issn":["2522-5839"],"journal_url":"https://www.nature.com/natmachintell/"},"article_type":"Article",
  "sources":[
    {"source_id":"src:natmachintell.content","source_url":"https://www.nature.com/natmachintell/content","source_type":"OFFICIAL_ARTICLE_TYPE_GUIDELINE","retrieved_at":"2026-09-29T00:00:00Z","source_title":"Nature Machine Intelligence: Content types","owner":"Nature Machine Intelligence","snapshot_hash":"sha256:6843bd89939179b5622c65e7272deb0ebd7ae7f6ef71a33a59d52f46ce7a5dce","snapshot_scope":"EVIDENCE_EXTRACT","content_stored":false,"verification_status":"VERIFIED"},
    {"source_id":"src:natmachintell.content-structure","source_url":"https://www.nature.com/natmachintell/content","source_type":"OFFICIAL_ARTICLE_TYPE_GUIDELINE","retrieved_at":"2026-09-29T00:00:00Z","source_title":"Nature Machine Intelligence: Content types","owner":"Nature Machine Intelligence","snapshot_hash":"sha256:2e4f2c901b6bce3fe56e14401b7a6ac3f1ee3671c3fecbd9e65517066521e8ca","snapshot_scope":"EVIDENCE_EXTRACT","content_stored":false,"verification_status":"VERIFIED"},
    {"source_id":"src:natmachintell.preparing","source_url":"https://www.nature.com/natmachintell/submission-guidelines/preparing-your-submission","source_type":"OFFICIAL_JOURNAL_GUIDELINE","retrieved_at":"2026-09-29T00:00:00Z","source_title":"Preparing your submission","owner":"Nature Machine Intelligence","snapshot_hash":"sha256:35db505eaa3a2b9e0553161c84bfd5d4d332bd00919887286f0e942ab212c3c2","snapshot_scope":"EVIDENCE_EXTRACT","content_stored":false,"verification_status":"VERIFIED"}
  ],
  "evidence":[
    {"evidence_id":"ev:natmachintell.limits","source_id":"src:natmachintell.content","locator":"Article","evidence_text":"Article limits: main text 3,500 words; abstract 150 words; display items 6; references guideline 50.","evidence_hash":"sha256:6843bd89939179b5622c65e7272deb0ebd7ae7f6ef71a33a59d52f46ce7a5dce"},
    {"evidence_id":"ev:natmachintell.structure","source_id":"src:natmachintell.content-structure","locator":"Article","evidence_text":"Article structure uses an unheaded Introduction, Results, Discussion and Methods; Discussion has no subheadings.","evidence_hash":"sha256:2e4f2c901b6bce3fe56e14401b7a6ac3f1ee3671c3fecbd9e65517066521e8ca"},
    {"evidence_id":"ev:natmachintell.materials","source_id":"src:natmachintell.preparing","locator":"Submission materials","evidence_text":"Submission materials include manuscript and cover letter, with supplementary information optional and up to 10 Extended Data items.","evidence_hash":"sha256:35db505eaa3a2b9e0553161c84bfd5d4d332bd00919887286f0e942ab212c3c2"}
  ],
  "rules":[
    {"rule_id":"identity.article_type","rule_version":"1.0.0","category":"IDENTITY","target":"article_type","operator":"EQ","value":"Article","unit":null,"severity":"BLOCKING","applicability":"This profile","machine_checkable":true,"autofix_class":"NONE","provenance":[{"source_id":"src:natmachintell.content","evidence_id":"ev:natmachintell.limits"}],"confidence":"HIGH","status":"VERIFIED","override_of":null,"override_reason":null},
    {"rule_id":"abstract.max_words","rule_version":"1.0.0","category":"LIMIT","target":"abstract","operator":"LTE","value":150,"unit":"words","severity":"BLOCKING","applicability":"Article","machine_checkable":true,"autofix_class":"AUTHOR_APPROVAL_REQUIRED","provenance":[{"source_id":"src:natmachintell.content","evidence_id":"ev:natmachintell.limits"}],"confidence":"HIGH","status":"VERIFIED","override_of":null,"override_reason":null},
    {"rule_id":"main_text.max_words","rule_version":"1.0.0","category":"LIMIT","target":"main_text","operator":"LTE","value":3500,"unit":"words","severity":"BLOCKING","applicability":"Article; excludes abstract, Methods, references and legends","machine_checkable":true,"autofix_class":"AUTHOR_APPROVAL_REQUIRED","provenance":[{"source_id":"src:natmachintell.content","evidence_id":"ev:natmachintell.limits"}],"confidence":"HIGH","status":"VERIFIED","override_of":null,"override_reason":null},
    {"rule_id":"references.max_count","rule_version":"1.0.0","category":"REFERENCE","target":"references","operator":"LTE","value":50,"unit":"references","severity":"WARNING","applicability":"Article; guideline","machine_checkable":true,"autofix_class":"AUTHOR_APPROVAL_REQUIRED","provenance":[{"source_id":"src:natmachintell.content","evidence_id":"ev:natmachintell.limits"}],"confidence":"MEDIUM","status":"PARTIAL","override_of":null,"override_reason":null},
    {"rule_id":"display_items.max_count","rule_version":"1.0.0","category":"FIGURE","target":"figures_and_tables","operator":"LTE","value":6,"unit":"items","severity":"BLOCKING","applicability":"Article","machine_checkable":true,"autofix_class":"AUTHOR_APPROVAL_REQUIRED","provenance":[{"source_id":"src:natmachintell.content","evidence_id":"ev:natmachintell.limits"}],"confidence":"HIGH","status":"VERIFIED","override_of":null,"override_reason":null},
    {"rule_id":"sections.required","rule_version":"1.0.0","category":"SECTION","target":"section_order","operator":"EQ","value":["Introduction","Results","Discussion","Methods"],"unit":null,"severity":"BLOCKING","applicability":"Article","machine_checkable":true,"autofix_class":"AUTHOR_APPROVAL_REQUIRED","provenance":[{"source_id":"src:natmachintell.content-structure","evidence_id":"ev:natmachintell.structure"}],"confidence":"HIGH","status":"VERIFIED","override_of":null,"override_reason":null},
    {"rule_id":"cover_letter.required","rule_version":"1.0.0","category":"FILE","target":"cover_letter","operator":"EXISTS","value":true,"unit":null,"severity":"BLOCKING","applicability":"Initial submission","machine_checkable":true,"autofix_class":"AUTHOR_APPROVAL_REQUIRED","provenance":[{"source_id":"src:natmachintell.preparing","evidence_id":"ev:natmachintell.materials"}],"confidence":"HIGH","status":"VERIFIED","override_of":null,"override_reason":null},
    {"rule_id":"supplement.allowed","rule_version":"1.0.0","category":"FILE","target":"supplementary_information","operator":"EXISTS","value":"OPTIONAL","unit":null,"severity":"INFO","applicability":"Article","machine_checkable":true,"autofix_class":"NONE","provenance":[{"source_id":"src:natmachintell.preparing","evidence_id":"ev:natmachintell.materials"}],"confidence":"HIGH","status":"VERIFIED","override_of":null,"override_reason":null},
    {"rule_id":"extended_data.max_count","rule_version":"1.0.0","category":"FIGURE","target":"extended_data","operator":"LTE","value":10,"unit":"items","severity":"WARNING","applicability":"If Extended Data are used","machine_checkable":true,"autofix_class":"AUTHOR_APPROVAL_REQUIRED","provenance":[{"source_id":"src:natmachintell.preparing","evidence_id":"ev:natmachintell.materials"}],"confidence":"HIGH","status":"VERIFIED","override_of":null,"override_reason":null},
    {"rule_id":"title.max_words","rule_version":"1.0.0","category":"LIMIT","target":"title","operator":"LTE","value":"UNKNOWN","unit":"words","severity":"WARNING","applicability":"Article","machine_checkable":false,"autofix_class":"NONE","provenance":[],"confidence":"UNKNOWN","status":"UNKNOWN","override_of":null,"override_reason":null},
    {"rule_id":"statements.code_availability.required","rule_version":"1.0.0","category":"STATEMENT","target":"code_availability","operator":"EXISTS","value":"UNKNOWN","unit":null,"severity":"WARNING","applicability":"Article","machine_checkable":false,"autofix_class":"NONE","provenance":[],"confidence":"UNKNOWN","status":"UNKNOWN","override_of":null,"override_reason":null},
    {"rule_id":"statements.ethics_consent.required","rule_version":"1.0.0","category":"STATEMENT","target":"ethics_and_consent","operator":"EXISTS","value":"UNKNOWN","unit":null,"severity":"WARNING","applicability":"Where applicable","machine_checkable":false,"autofix_class":"NONE","provenance":[],"confidence":"UNKNOWN","status":"UNKNOWN","override_of":null,"override_reason":null},
    {"rule_id":"title_page.requirements","rule_version":"1.0.0","category":"FILE","target":"title_page","operator":"CUSTOM","value":"UNKNOWN","unit":null,"severity":"WARNING","applicability":"Article","machine_checkable":false,"autofix_class":"NONE","provenance":[],"confidence":"UNKNOWN","status":"UNKNOWN","override_of":null,"override_reason":null},
    {"rule_id":"figures.separate_files","rule_version":"1.0.0","category":"FILE","target":"figure_files","operator":"EXISTS","value":"UNKNOWN","unit":null,"severity":"WARNING","applicability":"Initial submission","machine_checkable":false,"autofix_class":"NONE","provenance":[],"confidence":"UNKNOWN","status":"UNKNOWN","override_of":null,"override_reason":null}
  ],
  "last_verified_at":"2026-09-29T00:00:00Z","freshness_window_days":180,"status":"PARTIAL"
}
